item_number,desc1,desc1_source,desc2,desc2_source,human_label
51,"Vintage Delta Industrial Machinery Corp. SAWBUCK Frame & Trim Saw, model 33-150, serial 86 69696. Features a silver metal body, electrical cable, and a white circular saw blade. Perfect for woodworking and trimming tasks.",model,"Delta Sawbuck frame and trim saw, model 33-150, powered by a 115V AC motor with a 5/8"" arbor for use with 5500 RPM blades. Designed for precision framing cuts, mounted on a wheeled stand for portability. Made in the USA.",baseline,Both descriptions are acceptable
52,"Troy-Bilt 4-cycle gas-powered cultivator with a 26.2cc engine, compliant with EPA and California emissions regulations. Lightweight and compact with forward-rotating tines and durable wheels for maneuverability. Manufactured in 2008 with a 50-hour emissions compliance period.",baseline,"Red walk-behind lawn mower with black handle and wheels, ideal for small to moderate lawns. Features a 26.2 cc engine and meets U.S. EPA emissions regulations. Excellent condition, perfect for home or small garden use.",model,baseline
53,"Snapper 22-inch self-propelled walk-behind mower powered by a Briggs & Stratton 6.75 horsepower 190cc engine. Model SPV22675HW with rear bagging system, large rear wheels for easier handling, and adjustable handle height for user comfort.",baseline,"Used self-propelled lawn mower with red engine, gray wheels, and black fabric cover. Meets CPSC blade safety requirements. Ideal for efficient outdoor lawn care. Includes identification tag and operating instructions. Ready for immediate use.",model,baseline
54,"Vintage, mint-green, plastic wall-mounted sconce with a rocket-shaped design and yellow accent. Features dual lighting elements and a retro aesthetic. Includes ""EURO MOLD AND KEC INC"" label. Ideal for mid-century modern decor.",model,"Pair of vintage metal mechanical banks designed in the shape of a rocket and a planet with ring. Manufactured by Duro Mold and MFG Inc., Detroit, MI, and used as promotional pieces for Girard Battles National Bank. Distinct patina throughout.",baseline,baseline
55,"Vintage Bob Dylan album featuring iconic cover art with a bold, red ""BALL"" logo and intricate typography. Includes a detailed biographical insert. A must-have for Dylan collectors, showcasing classic design and historical significance. Perfect for display.",model,Framed Bob Dylan collector's set featuring a large men's T-shirt with vintage-style album artwork. Includes a printed insert highlighting Dylan’s career and musical influence. A great display piece for fans of classic folk and rock music.,baseline,baseline
56,"Husqvarna 136LE chainsaw powered by a 36cc 2-cycle engine. Made in the USA, designed to meet 2004 EPA and CARB emission standards with a 50-hour durability rating. Features include ergonomic handles and bar guard for enhanced safety and handling.",baseline,"Husqvarna chainsaw, orange with gray handles, 16"" bar, 3/8"" chain pitch, UL certified, 91VG/56 model, assembled in USA, low emissions, air injection system, ideal for small off-road engines, excellent condition.",model,Both descriptions are acceptable
57,"Vintage Lionel train track set, featuring a variety of curved and straight steel tracks with nickel-plated finish. Includes a metal track support piece. Ideal for model train enthusiasts seeking classic Lionel rolling stock components.",model,"Vintage Lionel Lines O-gauge electric train set featuring engine 2037, caboose 6017, several assorted freight cars, curved and straight track, transformer, and train station. Includes branded cars such as High Valley and distinctive tankers, log cars, and boxcars.",baseline,Both descriptions are acceptable
58,"Open gray plastic tool box containing a green and black handheld power drill, along with an instruction manual and safety warnings. The drill features a 2 1/2"" finish nailer and includes a 70-120psi air pressure setting. Easy to use and maintain.",model,"Hitachi NT65MA2 2-1/2” finish nailer with angled magazine, ergonomic grip, and depth adjustment. Housed in its original molded case with safety glasses and manual included. Designed for 15-gauge nails, ideal for trim and molding work.",baseline,baseline
59,"A set of four used Continental ProContact TX tires, featuring 185/50R16 size and 81H load rating. Tires are in good condition with visible manufacturer labels and instructions. Ideal for sport utility vehicles.",model,"Pair of Continental ProContact TX tires, size 185/50R16 81H, manufactured in 2015. Tires are unused with original labeling still attached. Clean tread and sidewalls suggest they have been stored well and remain in excellent condition.",baseline,Both descriptions are acceptable
60,"Vintage DeLonghi air heater with black and silver design, featuring a powerful 1500W output and adjustable temperature control. Includes a compact, cube-shaped black speaker unit on top. Ideal for cozy home use. Functional and stylish.",model,"Set of two space heaters including a LifeSmart 1500W infrared model with cord wrap and a DeLonghi HM-15 oil-filled radiator heater, both rated for 120V household use. Ideal for supplemental heating in small rooms or garages.",baseline,baseline
